title,file_urls,category,timestamp,files
Décret relatif à la mise en place du dispositif de contrôle de gestion au sein des départements ministériels,https://adala.justice.gov.ma/api/uploads/2026/01/08/D%C3%A9cret%20n%C2%B0%202-22-580%20relatif%20%C3%A0%20la%20mise%20en%20place%20du%20dispositif%20de%20contr%C3%B4le%20de%20gestion%20au%20sein%20des%20d%C3%A9partements%20minist%C3%A9riels.-1767885116409.pdf,Other,2026-07-13T12:06:32.925145,"[{'url': 'https://adala.justice.gov.ma/api/uploads/2026/01/08/D%C3%A9cret%20n%C2%B0%202-22-580%20relatif%20%C3%A0%20la%20mise%20en%20place%20du%20dispositif%20de%20contr%C3%B4le%20de%20gestion%20au%20sein%20des%20d%C3%A9partements%20minist%C3%A9riels.-1767885116409.pdf', 'path': 'Décret relatif à la mise en place du dispositif de contrôle de gestion au sein des départements ministériels.pdf', 'checksum': '7abfdc426ab495cc0c39b1d0135ede70', 'status': 'downloaded'}]"
Décret fixant la composition de la commission administrative instituée par la loi n° 24-96 relative à la poste et aux télécommunications,https://adala.justice.gov.ma/api/uploads/2025/12/01/D%C3%A9cret%20n%C2%B0%202-25-565%20fixant%20la%20composition%20de%20la%20commission%20administrative%20institu%C3%A9e%20par%20la%20loi%20n%C2%B0%2024-96%20relative%20%C3%A0%20la%20poste%20et%20aux%20t%C3%A9l%C3%A9communicat-1764583552146.pdf,Other,2026-07-13T12:06:32.923401,"[{'url': 'https://adala.justice.gov.ma/api/uploads/2025/12/01/D%C3%A9cret%20n%C2%B0%202-25-565%20fixant%20la%20composition%20de%20la%20commission%20administrative%20institu%C3%A9e%20par%20la%20loi%20n%C2%B0%2024-96%20relative%20%C3%A0%20la%20poste%20et%20aux%20t%C3%A9l%C3%A9communicat-1764583552146.pdf', 'path': 'Décret fixant la composition de la commission administrative instituée par la loi n 24-96 relative à la poste et aux télécommunications.pdf', 'checksum': '5423f2567895c9c8494427a5166a0ce7', 'status': 'downloaded'}]"
Décret fixant les conditions d'octroi de la garantie de l'Etat en couverture de la liquidité d'urgence,https://adala.justice.gov.ma/api/uploads/2026/01/09/D%C3%A9cret%20n%C2%B0%202-22-925%20-1767967454181.pdf,Other,2026-07-13T12:06:32.923626,"[{'url': 'https://adala.justice.gov.ma/api/uploads/2026/01/09/D%C3%A9cret%20n%C2%B0%202-22-925%20-1767967454181.pdf', 'path': 'Décret fixant les conditions doctroi de la garantie de lEtat en couverture de la liquidité durgence.pdf', 'checksum': '703ef620795bfc4dd8e25581abc6557a', 'status': 'downloaded'}]"
"Décret approuvant l'accord de garantie du 19 juin 2025, conclu entre le Royaume du Maroc et la Banque européenne pour la reconstruction et le développement (BERD), pour la garantie du prêt d'un montant de trois cent millions d'euros (300.000.000 €), consenti par ladite banque à l'Office national de l'électricité et de l'eau potable (ONEE), pour le financement du projet « Prêt durable (« sustainability linked loan ») ΟΝΕΕ »","https://adala.justice.gov.ma/api/uploads/2025/12/08/D%C3%A9cret%20n%C2%B0%202-25-653%20approuvant%20l'accord%20de%20garantie%20du%2019%20juin%202025,%20conclu%20entre%20le%20Royaume%20du%20Maroc%20et%20la%20Banque%20europ%C3%A9enne%20pour%20la%20reconstruct-1765186924821.pdf",Constitutional,2026-07-13T12:06:32.923149,
Décret instituant au profit du Fonds de solidarité contre les événements catastrophiques une taxe parafiscale dénommée « Taxe de solidarité contre les événements catastrophiques »,https://adala.justice.gov.ma/api/uploads/2025/10/17/d%C3%A9cret%20n%C2%B0%202-19-244%20instituant%20au%20profit%20du%20fonds%20de%20solidarit%C3%A9%20contre%20les%20%C3%A9v%C3%A9nement%20catastrophiques%20une%20taxe%20parafiscale%20d%C3%A9nom%C3%A9e%20taxe%20de%20solidar-1760708722244.pdf,Business,2026-07-13T12:06:32.922140,"[{'url': 'https://adala.justice.gov.ma/api/uploads/2025/10/17/d%C3%A9cret%20n%C2%B0%202-19-244%20instituant%20au%20profit%20du%20fonds%20de%20solidarit%C3%A9%20contre%20les%20%C3%A9v%C3%A9nement%20catastrophiques%20une%20taxe%20parafiscale%20d%C3%A9nom%C3%A9e%20taxe%20de%20solidar-1760708722244.pdf', 'path': 'Décret instituant au profit du Fonds de solidarité contre les événements catastrophiques une taxe parafiscale dénommée  Taxe de solidarité contre les événements catastrophiques.pdf', 'checksum': '7d4fb1d12ba23ce3e454ff82c210ecf1', 'status': 'downloaded'}]"
"Décret approuvant l'avenant à  la convention de crédit export, conclue  le 28 avril 2020 entre le Royaume du Maroc et BNP PARIBAS, pour le financement du contrat commercial conclu entre l'Administration de la défense nationale et la société MBDA France",https://adala.justice.gov.ma/api/uploads/2025/12/01/D%C3%A9cret%20n%C2%B02-25-635%20approuvant%20l'avenant%20%C3%A0%20%C3%A0%20la%20convention%20de%20cr%C3%A9dit%20export-1764583132953.pdf,Constitutional,2026-07-13T12:06:32.922638,"[{'url': 'https://adala.justice.gov.ma/api/uploads/2025/12/01/D%C3%A9cret%20n%C2%B02-25-635%20approuvant%20l%27avenant%20%C3%A0%20%C3%A0%20la%20convention%20de%20cr%C3%A9dit%20export-1764583132953.pdf', 'path': 'Décret approuvant lavenant à  la convention de crédit export conclue  le 28 avril 2020 entre le Royaume du Maroc et BNP PARIBAS pour le financement du contrat commercial conclu entre lAdministration de la défense nationale et la société MBDA France.pdf', 'checksum': '4735ec9980cafa269fab18b3cfdaa781', 'status': 'downloaded'}]"
